{
  "$schema": "https://json-schema.org/draft/2020-12/schema",
  "$id": "https://pfem.local/schemas/retention_access_ledger_record.schema.json",
  "title": "PFEM Retention Access Ledger Records",
  "type": "object",
  "required": [
    "retention_access_ledger_record_id",
    "access_ledger_kind",
    "created_time",
    "node_id",
    "retention_access_grant_closeout_record_id",
    "retention_access_grant_verification_receipt_id",
    "access_ledger_state",
    "access_ledger_scope",
    "access_ledger_refs",
    "subject_refs",
    "basis_refs",
    "digest_algorithm",
    "access_ledger_ref_digest",
    "access_ledger_by_ref",
    "summary"
  ],
  "properties": {
    "retention_access_ledger_record_id": {
      "type": "string"
    },
    "access_ledger_kind": {
      "type": "string"
    },
    "created_time": {
      "type": "string"
    },
    "node_id": {
      "type": "string"
    },
    "retention_access_grant_closeout_record_id": {
      "type": "string"
    },
    "retention_access_grant_verification_receipt_id": {
      "type": "string"
    },
    "access_ledger_state": {
      "type": "string"
    },
    "access_ledger_scope": {
      "type": "string"
    },
    "access_ledger_refs": {
      "type": "array"
    },
    "subject_refs": {
      "type": "array"
    },
    "basis_refs": {
      "type": "array"
    },
    "digest_algorithm": {
      "type": "string"
    },
    "access_ledger_ref_digest": {
      "type": "string"
    },
    "access_ledger_by_ref": {
      "type": "string"
    },
    "summary": {
      "type": "string"
    }
  },
  "additionalProperties": true
}
